{
  "packet_id": "glp1r_retrospective_blind_v1:boundary:r1",
  "task_id": "glp1r_retrospective_blind_v1",
  "stage_id": "boundary",
  "stage_contract_version": "1.0.0",
  "task_track": "retrospective_blind",
  "inputs_frozen": [
    "full_length_sequence",
    "public_msa_databases",
    "membrane_system_setup_protocol"
  ],
  "priors_approved": [
    "information_boundary_sheet",
    "default_allodesigner_reference_path"
  ],
  "tools_considered": [
    {
      "tool_id": "case_protocol_template",
      "role": "reuse",
      "decision": "selected",
      "rationale": "From AlloDesigner reference path / stage defaults"
    }
  ],
  "tool_selected": [
    "case_protocol_template"
  ],
  "outputs": {
    "iterations": [],
    "pipeline": {
      "status": "completed",
      "maturity": "executable",
      "artifacts": {
        "boundary_sheet": "/lambda/nfs/file2/jrf/AlloDesigner/AlloDesigner_MultiAgent/runs/20260809T122127Z_glp1r_retrospective_blind_v1/artifacts/boundary/boundary_sheet.json"
      },
      "next_input": "residue_prior uses sequence_ref + apo ensemble npy",
      "env_decision": {
        "stage_id": "boundary",
        "profile_id": "agent_base",
        "specialized": false,
        "action": "use_current",
        "env_name": "__current__",
        "env_path": null,
        "python_executable": "/home/ubuntu/miniconda3/bin/python",
        "matched_by": "non_specialized_stage",
        "score": 1.0,
        "create_yml": null,
        "command_prefix": [],
        "notes": [
          "No special env required; use current interpreter/tools"
        ],
        "probe_details": {}
      }
    }
  },
  "metrics": {},
  "qc_flags": [],
  "human_interventions": [],
  "claims_allowed": [
    "已形成待审批/已审批的信息边界协议"
  ],
  "iteration": {
    "round": 1,
    "stop_reason": "completed"
  },
  "critic": {
    "passed": true,
    "findings": [],
    "claims_allowed": [
      "已形成待审批/已审批的信息边界协议"
    ],
    "claims_forbidden": [
      "已发现真实变构口袋",
      "已证实配体有效"
    ]
  },
  "status": "completed",
  "maturity": "executable"
}