{
  "packet_id": "glp1r_retrospective_blind_v1:candidate_ranking:r1",
  "task_id": "glp1r_retrospective_blind_v1",
  "stage_id": "candidate_ranking",
  "stage_contract_version": "1.0.0",
  "task_track": "retrospective_blind",
  "inputs_frozen": [
    "full_length_sequence",
    "public_msa_databases",
    "membrane_system_setup_protocol"
  ],
  "priors_approved": [
    "information_boundary_sheet",
    "default_allodesigner_reference_path"
  ],
  "tools_considered": [
    {
      "tool_id": "glp1r_virtual_screening_protocol",
      "role": "reuse",
      "decision": "selected",
      "rationale": "From AlloDesigner reference path / stage defaults"
    },
    {
      "tool_id": "vina",
      "role": "alternative",
      "decision": "deferred",
      "rationale": "Available alternative; not selected in default plan"
    },
    {
      "tool_id": "karmadock",
      "role": "alternative",
      "decision": "deferred",
      "rationale": "Available alternative; not selected in default plan"
    },
    {
      "tool_id": "glide",
      "role": "alternative",
      "decision": "deferred",
      "rationale": "Available alternative; not selected in default plan"
    }
  ],
  "tool_selected": [
    "glp1r_virtual_screening_protocol"
  ],
  "outputs": {
    "iterations": [],
    "pipeline": {
      "status": "needs_external",
      "paper_stage": "structure-based virtual screening",
      "protocol": [
        "glp1r_virtual_screening_protocol"
      ],
      "alternatives": [
        "vina",
        "karmadock",
        "glide"
      ],
      "inputs_from": [
        "pocket_evaluation",
        "physics_sampling"
      ],
      "claim_boundary": "计算候选物排序，不得宣称实验有效",
      "expected_outputs": [
        "ranked_candidates.csv",
        "poses/",
        "protocol_version.json"
      ],
      "artifacts": {
        "job_sheet": "/lambda/nfs/file2/jrf/AlloDesigner/AlloDesigner_MultiAgent/runs/20260809T122127Z_glp1r_retrospective_blind_v1/artifacts/candidate_ranking/job_sheet.json"
      },
      "env_decision": {
        "stage_id": "candidate_ranking",
        "profile_id": "agent_base",
        "specialized": false,
        "action": "use_current",
        "env_name": "__current__",
        "env_path": null,
        "python_executable": "/home/ubuntu/miniconda3/bin/python",
        "matched_by": "non_specialized_stage",
        "score": 1.0,
        "create_yml": null,
        "command_prefix": [],
        "notes": [
          "No special env required; use current interpreter/tools"
        ],
        "probe_details": {}
      }
    }
  },
  "metrics": {},
  "qc_flags": [],
  "human_interventions": [],
  "claims_allowed": [
    "计算候选物已排序，待实验/专家复核"
  ],
  "iteration": {
    "round": 1,
    "stop_reason": "needs_external"
  },
  "critic": {
    "passed": true,
    "findings": [],
    "claims_allowed": [
      "计算候选物已排序，待实验/专家复核"
    ],
    "claims_forbidden": [
      "有效配体/抑制剂已被证实"
    ]
  },
  "status": "needs_human",
  "maturity": "paper_only"
}