{
  "packet_id": "glp1r_retrospective_blind_v1:pocket_evaluation:r1",
  "task_id": "glp1r_retrospective_blind_v1",
  "stage_id": "pocket_evaluation",
  "stage_contract_version": "1.0.0",
  "task_track": "retrospective_blind",
  "inputs_frozen": [
    "full_length_sequence",
    "public_msa_databases",
    "membrane_system_setup_protocol"
  ],
  "priors_approved": [
    "information_boundary_sheet",
    "default_allodesigner_reference_path"
  ],
  "tools_considered": [
    {
      "tool_id": "dbscan_residue_clustering",
      "role": "reuse",
      "decision": "selected",
      "rationale": "From AlloDesigner reference path / stage defaults"
    },
    {
      "tool_id": "fpocket",
      "role": "reuse",
      "decision": "selected",
      "rationale": "From AlloDesigner reference path / stage defaults"
    },
    {
      "tool_id": "deepallo",
      "role": "reuse",
      "decision": "selected",
      "rationale": "From AlloDesigner reference path / stage defaults"
    },
    {
      "tool_id": "plb",
      "role": "reuse",
      "decision": "selected",
      "rationale": "From AlloDesigner reference path / stage defaults"
    }
  ],
  "tool_selected": [
    "dbscan_residue_clustering",
    "fpocket",
    "deepallo",
    "plb"
  ],
  "outputs": {
    "iterations": [],
    "pipeline": {
      "status": "partial_seeded",
      "clustering": {
        "algorithm": "dbscan",
        "eps": 6.0,
        "min_samples": 2
      },
      "scorers": [
        "fpocket",
        "deepallo",
        "plb"
      ],
      "commands": [
        "cd /lambda/nfs/file2/jrf/AlloDesigner/Allo_af_claseq && python 4_postgrasp_clustering_pocketminer_apo_dir_step3.py  # eps~6.0",
        "cd /lambda/nfs/file2/jrf/AlloDesigner/Allo_af_claseq && python 6_inference_case_pocketminer_cluster_to_deepallo_run.py",
        "cd /lambda/nfs/file2/jrf/AlloDesigner/Allo_af_claseq && python 7_plb_calculation_pocketminer_apo_dir_step3.py",
        "cd /lambda/nfs/file2/jrf/AlloDesigner/Allo_af_claseq && python 6.1_calculate_apo_pocketminer_cluster_deepallo_score.py",
        "cd /lambda/nfs/file2/jrf/AlloDesigner/Allo_af_claseq && python 7.1_calculate_apo_pocketminer_cluster_plb_score.py"
      ],
      "artifacts": {
        "run_chain_sh": "/lambda/nfs/file2/jrf/AlloDesigner/AlloDesigner_MultiAgent/runs/20260809T121343Z_glp1r_retrospective_blind_v1/artifacts/pocket_evaluation/run_chain.sh",
        "glp1-deepallo-score-residue_probabilities_top_7.csv": "/lambda/nfs/file2/jrf/AlloDesigner/AlloDesigner_MultiAgent/runs/20260809T121343Z_glp1r_retrospective_blind_v1/artifacts/pocket_evaluation/glp1-deepallo-score-residue_probabilities_top_7.csv",
        "glp1-plb-score-residue_probabilities_top_7.csv": "/lambda/nfs/file2/jrf/AlloDesigner/AlloDesigner_MultiAgent/runs/20260809T121343Z_glp1r_retrospective_blind_v1/artifacts/pocket_evaluation/glp1-plb-score-residue_probabilities_top_7.csv"
      },
      "note": "Full eval needs AF_ClaSeq case directory + fpocket + DeepAllo env"
    }
  },
  "metrics": {},
  "qc_flags": [],
  "human_interventions": [],
  "claims_allowed": [
    "候选口袋已按合同排序，存在不确定性说明"
  ],
  "iteration": {
    "round": 1,
    "stop_reason": "partial_seeded"
  },
  "critic": {
    "passed": true,
    "findings": [],
    "claims_allowed": [
      "候选口袋已按合同排序，存在不确定性说明"
    ],
    "claims_forbidden": [
      "真实口袋已确认"
    ]
  },
  "status": "needs_human",
  "maturity": "external"
}