{
  "packet_id": "glp1r_retrospective_blind_v1:physics_sampling:r1",
  "task_id": "glp1r_retrospective_blind_v1",
  "stage_id": "physics_sampling",
  "stage_contract_version": "1.0.0",
  "task_track": "retrospective_blind",
  "inputs_frozen": [
    "full_length_sequence",
    "public_msa_databases",
    "membrane_system_setup_protocol"
  ],
  "priors_approved": [
    "information_boundary_sheet",
    "default_allodesigner_reference_path"
  ],
  "tools_considered": [
    {
      "tool_id": "ai_prior_metadynamics",
      "role": "reuse",
      "decision": "selected",
      "rationale": "From AlloDesigner reference path / stage defaults"
    },
    {
      "tool_id": "unbiased_md",
      "role": "benchmark",
      "decision": "benchmark_only",
      "rationale": "Benchmark control; reported separately"
    }
  ],
  "tool_selected": [
    "ai_prior_metadynamics"
  ],
  "outputs": {
    "iterations": [],
    "pipeline": {
      "status": "needs_external",
      "paper_stage": "AI-prior metadynamics / biased MD",
      "cv_candidates": [
        "pocket_sasa",
        "key_residue_pair_distance"
      ],
      "budget_ns": 50,
      "benchmarks": [
        "unbiased_md"
      ],
      "system_setup": "CHARMM-GUI POPC + AMBER for GPCR membrane system (paper/SI)",
      "callback_contract": {
        "upload": [
          "openlike_frames/",
          "cv_timeseries.csv",
          "pocket_volume_trace.csv"
        ],
        "claims_allowed": [
          "在给定 CV 与预算下采样到开放样构象候选"
        ]
      },
      "artifacts": {
        "job_sheet": "/lambda/nfs/file2/jrf/AlloDesigner/AlloDesigner_MultiAgent/runs/20260809T121343Z_glp1r_retrospective_blind_v1/artifacts/physics_sampling/job_sheet.json"
      }
    }
  },
  "metrics": {
    "budget_ns": 50
  },
  "qc_flags": [],
  "human_interventions": [],
  "claims_allowed": [
    "在给定 CV 与预算下采样到开放样构象候选"
  ],
  "iteration": {
    "round": 1,
    "stop_reason": "needs_external"
  },
  "critic": {
    "passed": true,
    "findings": [],
    "claims_allowed": [
      "在给定 CV 与预算下采样到开放样构象候选"
    ],
    "claims_forbidden": [
      "机制已证实"
    ]
  },
  "status": "needs_human",
  "maturity": "external"
}