{
  "packet_id": "glp1r_retrospective_blind_v1:residue_prior:r1",
  "task_id": "glp1r_retrospective_blind_v1",
  "stage_id": "residue_prior",
  "stage_contract_version": "1.0.0",
  "task_track": "retrospective_blind",
  "inputs_frozen": [
    "full_length_sequence",
    "public_msa_databases",
    "membrane_system_setup_protocol"
  ],
  "priors_approved": [
    "information_boundary_sheet",
    "default_allodesigner_reference_path"
  ],
  "tools_considered": [
    {
      "tool_id": "allo_pocketminer",
      "role": "reuse",
      "decision": "selected",
      "rationale": "From AlloDesigner reference path / stage defaults"
    },
    {
      "tool_id": "pocketminer_baseline",
      "role": "benchmark",
      "decision": "benchmark_only",
      "rationale": "Benchmark control; reported separately"
    }
  ],
  "tool_selected": [
    "allo_pocketminer"
  ],
  "outputs": {
    "iterations": [],
    "pipeline": {
      "status": "completed",
      "out_csv": "/lambda/nfs/file2/jrf/AlloDesigner/AlloDesigner_MultiAgent/runs/20260809T130025Z_glp1r_retrospective_blind_v1/artifacts/residue_prior/GLP1R_residue_probs.csv",
      "threshold": 0.7,
      "n_residues": 491,
      "n_positive": 119,
      "weights": "/lambda/nfs/file2/jrf/AlloDesigner/Allo-PocketMiner/model_weight/1748397928_003",
      "runner": "conda_or_python_subprocess",
      "cmd": [
        "conda",
        "run",
        "-n",
        "allo-pocketminer",
        "--no-capture-output",
        "python",
        "/lambda/nfs/file2/jrf/AlloDesigner/Allo-PocketMiner/_agent_predict_glp1.py",
        "--out",
        "/lambda/nfs/file2/jrf/AlloDesigner/AlloDesigner_MultiAgent/runs/20260809T130025Z_glp1r_retrospective_blind_v1/artifacts/residue_prior/GLP1R_residue_probs.csv",
        "--threshold",
        "0.7",
        "--batch-size",
        "16",
        "--weights",
        "/lambda/nfs/file2/jrf/AlloDesigner/Allo-PocketMiner/model_weight/1748397928_003"
      ],
      "artifacts": {
        "residue_csv": "/lambda/nfs/file2/jrf/AlloDesigner/AlloDesigner_MultiAgent/runs/20260809T130025Z_glp1r_retrospective_blind_v1/artifacts/residue_prior/GLP1R_residue_probs.csv"
      },
      "env_decision": {
        "stage_id": "residue_prior",
        "profile_id": "allo_pocketminer",
        "specialized": true,
        "action": "reuse",
        "env_name": "allo-pocketminer",
        "env_path": "/lambda/nfs/file2/cqr_files/BioClaw_gpu_envs/allo-pocketminer",
        "python_executable": "/lambda/nfs/file2/cqr_files/BioClaw_gpu_envs/allo-pocketminer/bin/python",
        "matched_by": "name+markers",
        "score": 15.5,
        "create_yml": "/lambda/nfs/file2/jrf/AlloDesigner/allo-pocketminer-environment.yml",
        "command_prefix": [
          "conda",
          "run",
          "-n",
          "allo-pocketminer",
          "--no-capture-output"
        ],
        "notes": [
          "Reuse env 'allo-pocketminer' for profile 'allo_pocketminer' (score=15.5)"
        ],
        "probe_details": {
          "required": {
            "tensorflow": true,
            "keras": true,
            "numpy": true,
            "sklearn": true,
            "Bio": true
          },
          "optional_import": {
            "mdtraj": false,
            "tqdm": true
          },
          "optional_commands": {},
          "name_alias_hit": true
        }
      }
    }
  },
  "metrics": {
    "threshold": 0.7,
    "n_positive": 119,
    "n_residues": 491
  },
  "qc_flags": [],
  "human_interventions": [],
  "claims_allowed": [
    "候选残基/区域先验已生成，待后续构象与物理验证"
  ],
  "iteration": {
    "round": 1,
    "stop_reason": "completed"
  },
  "critic": {
    "passed": true,
    "findings": [],
    "claims_allowed": [
      "候选残基/区域先验已生成，待后续构象与物理验证"
    ],
    "claims_forbidden": [
      "已确认功能变构位点"
    ]
  },
  "status": "completed",
  "maturity": "executable"
}