{
  "packet_id": "glp1r_retrospective_blind_v1:boundary:r1",
  "task_id": "glp1r_retrospective_blind_v1",
  "stage_id": "boundary",
  "stage_contract_version": "1.0.0",
  "task_track": "retrospective_blind",
  "inputs_frozen": [
    "full_length_sequence",
    "public_msa_databases",
    "membrane_system_setup_protocol"
  ],
  "priors_approved": [
    "information_boundary_sheet",
    "default_allodesigner_reference_path"
  ],
  "tools_considered": [
    {
      "tool_id": "case_protocol_template",
      "role": "reuse",
      "decision": "selected",
      "rationale": "From AlloDesigner reference path / stage defaults"
    }
  ],
  "tool_selected": [
    "case_protocol_template"
  ],
  "outputs": {
    "iterations": [
      {
        "outputs": {
          "boundary_sheet": {
            "target": {
              "name": "GLP1R",
              "sequence_ref": "../AlphaFlow/GLP1_chain_seqres.csv",
              "uniprot": "P43220",
              "organism": "Homo sapiens"
            },
            "track": "retrospective_blind",
            "allowed_priors": [
              "full_length_sequence",
              "public_msa_databases",
              "membrane_system_setup_protocol"
            ],
            "forbidden_information": [
              "holo_structure_as_runtime_input",
              "crystal_ligand_coordinates",
              "manually_selected_answer_residues",
              "answer_key_pocket_definition"
            ],
            "answer_store_ref": "evaluation_only://glp1r/5vex_nam_pocket",
            "pending_approvals": []
          }
        },
        "metrics": {
          "pending_approvals": 0
        },
        "stop": true,
        "stop_reason": "boundary_sheet_drafted"
      }
    ]
  },
  "metrics": {
    "pending_approvals": 0
  },
  "qc_flags": [],
  "human_interventions": [],
  "claims_allowed": [
    "已形成待审批/已审批的信息边界协议"
  ],
  "iteration": {
    "round": 1,
    "stop_reason": "boundary_sheet_drafted"
  },
  "critic": {
    "passed": true,
    "findings": [],
    "claims_allowed": [
      "已形成待审批/已审批的信息边界协议"
    ],
    "claims_forbidden": [
      "已发现真实变构口袋",
      "已证实配体有效"
    ]
  },
  "status": "completed",
  "maturity": "executable"
}