{
  "packet_id": "glp1r_retrospective_blind_v1:residue_prior:r1",
  "task_id": "glp1r_retrospective_blind_v1",
  "stage_id": "residue_prior",
  "stage_contract_version": "1.0.0",
  "task_track": "retrospective_blind",
  "inputs_frozen": [
    "full_length_sequence",
    "public_msa_databases",
    "membrane_system_setup_protocol"
  ],
  "priors_approved": [
    "information_boundary_sheet",
    "default_allodesigner_reference_path"
  ],
  "tools_considered": [
    {
      "tool_id": "allo_pocketminer",
      "role": "reuse",
      "decision": "selected",
      "rationale": "From AlloDesigner reference path / stage defaults"
    },
    {
      "tool_id": "pocketminer_baseline",
      "role": "benchmark",
      "decision": "benchmark_only",
      "rationale": "Benchmark control; reported separately"
    }
  ],
  "tool_selected": [
    "allo_pocketminer"
  ],
  "outputs": {
    "iterations": [],
    "pipeline": {
      "status": "blocked",
      "reason": "tensorflow_not_installed",
      "hint": "pip install tensorflow  # or use PocketMiner conda env",
      "planned_entrypoint": "/lambda/nfs/file2/jrf/AlloDesigner/Allo-PocketMiner/case_predict.py",
      "planned_data": "/lambda/nfs/file2/jrf/AlloDesigner/Allo-PocketMiner/data/case/GLP1/5vex_apo_model.npy",
      "seed_artifact": "/lambda/nfs/file2/jrf/AlloDesigner/AlloDesigner_MultiAgent/runs/20260809T121343Z_glp1r_retrospective_blind_v1/artifacts/residue_prior/seed_from_paper_side_output.csv",
      "chain_policy": "PocketMiner blocked; seeded SI/case side CSV only for downstream wiring demo"
    }
  },
  "metrics": {},
  "qc_flags": [
    "tensorflow_not_installed",
    "PocketMiner blocked; seeded SI/case side CSV only for downstream wiring demo"
  ],
  "human_interventions": [],
  "claims_allowed": [
    "候选残基/区域先验已生成，待后续构象与物理验证"
  ],
  "iteration": {
    "round": 1,
    "stop_reason": "blocked"
  },
  "critic": {
    "passed": true,
    "findings": [],
    "claims_allowed": [
      "候选残基/区域先验已生成，待后续构象与物理验证"
    ],
    "claims_forbidden": [
      "已确认功能变构位点"
    ]
  },
  "status": "blocked",
  "maturity": "executable"
}