{
  "packet_id": "glp1r_retrospective_blind_v1:candidate_ranking:r1",
  "task_id": "glp1r_retrospective_blind_v1",
  "stage_id": "candidate_ranking",
  "stage_contract_version": "1.0.0",
  "task_track": "retrospective_blind",
  "inputs_frozen": [
    "full_length_sequence",
    "public_msa_databases",
    "membrane_system_setup_protocol"
  ],
  "priors_approved": [
    "information_boundary_sheet",
    "default_allodesigner_reference_path"
  ],
  "tools_considered": [
    {
      "tool_id": "glp1r_virtual_screening_protocol",
      "role": "reuse",
      "decision": "selected",
      "rationale": "From AlloDesigner reference path / stage defaults"
    },
    {
      "tool_id": "vina",
      "role": "alternative",
      "decision": "deferred",
      "rationale": "Available alternative; not selected in default plan"
    },
    {
      "tool_id": "karmadock",
      "role": "alternative",
      "decision": "deferred",
      "rationale": "Available alternative; not selected in default plan"
    },
    {
      "tool_id": "glide",
      "role": "alternative",
      "decision": "deferred",
      "rationale": "Available alternative; not selected in default plan"
    }
  ],
  "tool_selected": [
    "glp1r_virtual_screening_protocol"
  ],
  "outputs": {
    "iterations": [
      {
        "outputs": {
          "mode": "paper_only_or_external",
          "protocol": "glp1r_virtual_screening_protocol",
          "alternatives": [
            "vina",
            "karmadock",
            "glide"
          ],
          "claim_boundary": "计算候选物排序，不得宣称实验有效",
          "planned_artifacts": [
            "ranked_candidates.csv",
            "protocol_version.json"
          ]
        },
        "metrics": {},
        "stop": true,
        "stop_reason": "ranking_packet_planned"
      }
    ],
    "job_sheet": {
      "message": "External/paper_only tools require executor callback or human run.",
      "tools": [
        "glp1r_virtual_screening_protocol"
      ]
    }
  },
  "metrics": {},
  "qc_flags": [],
  "human_interventions": [],
  "claims_allowed": [
    "计算候选物已排序，待实验/专家复核"
  ],
  "iteration": {
    "round": 1,
    "stop_reason": "ranking_packet_planned"
  },
  "critic": {
    "passed": true,
    "findings": [],
    "claims_allowed": [
      "计算候选物已排序，待实验/专家复核"
    ],
    "claims_forbidden": [
      "有效配体/抑制剂已被证实"
    ]
  },
  "status": "needs_human",
  "maturity": "paper_only"
}