{
  "packet_id": "glp1r_retrospective_blind_v1:residue_prior:r1",
  "task_id": "glp1r_retrospective_blind_v1",
  "stage_id": "residue_prior",
  "stage_contract_version": "1.0.0",
  "task_track": "retrospective_blind",
  "inputs_frozen": [
    "full_length_sequence",
    "public_msa_databases",
    "membrane_system_setup_protocol"
  ],
  "priors_approved": [
    "information_boundary_sheet",
    "default_allodesigner_reference_path"
  ],
  "tools_considered": [
    {
      "tool_id": "allo_pocketminer",
      "role": "reuse",
      "decision": "selected",
      "rationale": "From AlloDesigner reference path / stage defaults"
    },
    {
      "tool_id": "pocketminer_baseline",
      "role": "benchmark",
      "decision": "benchmark_only",
      "rationale": "Benchmark control; reported separately"
    }
  ],
  "tool_selected": [
    "allo_pocketminer"
  ],
  "outputs": {
    "iterations": [
      {
        "outputs": {
          "mode": "dry_run",
          "entrypoint": "../Allo-PocketMiner/case_predict.py",
          "aggregation": "mean",
          "threshold": 0.7,
          "planned_artifacts": [
            "residue_probabilities.csv",
            "thresholded_residues.json"
          ]
        },
        "metrics": {
          "threshold": 0.7,
          "reference_pr_auc": 0.701,
          "baseline_pr_auc": 0.582
        },
        "stop": true,
        "stop_reason": "prior_plan_ready"
      }
    ]
  },
  "metrics": {
    "threshold": 0.7,
    "reference_pr_auc": 0.701,
    "baseline_pr_auc": 0.582
  },
  "qc_flags": [],
  "human_interventions": [],
  "claims_allowed": [
    "候选残基/区域先验已生成，待后续构象与物理验证"
  ],
  "iteration": {
    "round": 1,
    "stop_reason": "prior_plan_ready"
  },
  "critic": {
    "passed": true,
    "findings": [],
    "claims_allowed": [
      "候选残基/区域先验已生成，待后续构象与物理验证"
    ],
    "claims_forbidden": [
      "已确认功能变构位点"
    ]
  },
  "status": "completed",
  "maturity": "executable"
}